<?xml version="1.0" encoding="utf-8"?>

<library 
xmlns:xs="http://www.w3.org/2001/XMLSchema-instance" 
xs:noNamespaceSchemaLocation="library.xsd">
	
	<Book>
		<Title>Dead to the World</Title>
		<Author>Charlaine Harris</Author>
		<Publisher>ABC Publishing company</Publisher>
		<Cover cover_type="Hardbook"/>
		<Category cat_type="Horror"/>
		<ISBN isbn_num="Z1"/>
		<Rating rate_Val="5"/>
		<Price>$13.97</Price>
		<Comments>A good book</Comments>
	</Book>

	<Book>
		<Title>Gardens of the Moon </Title>
		<Author>Steven Erikson</Author>
		<Publisher>XYZ Publishers</Publisher>
		<Cover cover_type="Hardbook"></Cover>
		<Category cat_type="SCI-FI"></Category>
		<ISBN isbn_num="Z3"></ISBN>
		<Rating rate_Val="4"></Rating>
		<Price>$17.65</Price>
		<Comments>A wonderful book</Comments>
	</Book>
</library>

